[
  {
    "video_id": "clip_0001_kiss_prolonged",
    "source": "TITLE (year) — 00:12:30–00:12:55",
    "duration_s": 25.0,
    "guide_version": "1.0",
    "annotators": ["A", "B"],
    "shots": [
      {"idx": 0, "start_s": 0.0, "end_s": 6.0},
      {"idx": 1, "start_s": 6.0, "end_s": 14.0},
      {"idx": 2, "start_s": 14.0, "end_s": 25.0}
    ],
    "detections": [],
    "truth": [
      {"category": "C4", "start_s": 7.2, "end_s": 12.8, "note": "prolonged, well-lit"}
    ]
  },
  {
    "video_id": "clip_0002_cheek_kiss_greeting",
    "source": "TITLE (year) — hard negative: la bise greeting",
    "duration_s": 18.0,
    "guide_version": "1.0",
    "annotators": ["A", "B"],
    "shots": [
      {"idx": 0, "start_s": 0.0, "end_s": 9.0},
      {"idx": 1, "start_s": 9.0, "end_s": 18.0}
    ],
    "detections": [],
    "truth": []
  }
]
